<!ELEMENT livros (livro+)>
<!ELEMENT livro (editora, titulo, edicao, isbn, autores)>
<!ELEMENT editora (#PCDATA)>
<!ELEMENT titulo (#PCDATA)>
<!ELEMENT edicao (#PCDATA)>
<!ELEMENT isbn (#PCDATA)>
<!ELEMENT autores (autor+)>
<!ELEMENT autor (nome, address)>
<!ELEMENT nome (#PCDATA)>
<!ELEMENT address (#PCDATA)>
<!ATTLIST livro ano CDATA #REQUIRED>
